{
  "schemaVersion": "v0",
  "revision": "sha256.ccd1ae3732d4948ee52bdde2cd1ab299a0b548e3e3cab51eca38e1e644b66115",
  "assurance": "contract-seed",
  "generatedFrom": "omarchy.ultimate.software.seed.2026-08-27",
  "sources": [
    {"id":"source.omarchy.curated","type":"curated","title":"Omarchy curated software","trustLevel":"core","signatureKeyId":"omarchy-release-v1"},
    {"id":"source.arch.signed","type":"signed-repo","title":"Signed Arch repositories","trustLevel":"signed","signatureKeyId":"archlinux-master"},
    {"id":"source.flathub.verified","type":"flatpak","title":"Verified Flathub applications","trustLevel":"signed","signatureKeyId":"flathub-summary-v1"},
    {"id":"source.aur.reviewed","type":"reviewed-aur","title":"Omarchy reviewed AUR snapshots","trustLevel":"reviewed","signatureKeyId":"omarchy-aur-review-v1"},
    {"id":"source.appimage.reviewed","type":"appimage","title":"Reviewed AppImage artifacts","trustLevel":"sandboxed","signatureKeyId":"omarchy-appimage-review-v1"},
    {"id":"source.webapp.reviewed","type":"web-app","title":"Reviewed web applications","trustLevel":"sandboxed","signatureKeyId":"omarchy-web-review-v1"}
  ],
  "entries": [
    {"id":"software.curated.neovim","sourceId":"source.omarchy.curated","sourceType":"curated","packageRef":"neovim","displayName":"Neovim","summary":"Curated modal editor from the Omarchy default channel.","version":"0.11","architecture":"x86_64","keywords":["editor","terminal"],"provenance":{"assurance":"contract-seed","publisher":"Omarchy","origin":"https://archlinux.org/packages/extra/x86_64/neovim/","artifactDigest":"sha256:1111111111111111111111111111111111111111111111111111111111111111","reviewRevision":"sha256:aaaaaaaaaaaaaaaaaaaaaaaaaaaaaaaaaaaaaaaaaaaaaaaaaaaaaaaaaaaaaaaa","trustLevel":"core","signature":{"status":"declared","keyId":"omarchy-release-v1"}},"install":{"requiredBytes":104857600,"permissions":[],"conflicts":[]}},
    {"id":"software.repo.libreoffice","sourceId":"source.arch.signed","sourceType":"signed-repo","packageRef":"libreoffice-fresh","displayName":"LibreOffice","summary":"Desktop office suite from signed Arch repositories.","version":"25.2","architecture":"x86_64","keywords":["office","documents"],"provenance":{"assurance":"contract-seed","publisher":"The Document Foundation","origin":"https://archlinux.org/packages/extra/x86_64/libreoffice-fresh/","artifactDigest":"sha256:2222222222222222222222222222222222222222222222222222222222222222","reviewRevision":"sha256:bbbbbbbbbbbbbbbbbbbbbbbbbbbbbbbbbbbbbbbbbbbbbbbbbbbbbbbbbbbbbbbb","trustLevel":"signed","signature":{"status":"declared","keyId":"archlinux-master"}},"install":{"requiredBytes":734003200,"permissions":["filesystem-home"],"conflicts":[]}},
    {"id":"software.flatpak.spotify","sourceId":"source.flathub.verified","sourceType":"flatpak","packageRef":"com.spotify.Client","displayName":"Spotify","summary":"Sandboxed Spotify desktop client from declared Flathub contract metadata.","version":"1.2","architecture":"x86_64","keywords":["music","audio"],"provenance":{"assurance":"contract-seed","publisher":"Spotify AB","origin":"https://flathub.org/apps/com.spotify.Client","artifactDigest":"sha256:3333333333333333333333333333333333333333333333333333333333333333","reviewRevision":"sha256:cccccccccccccccccccccccccccccccccccccccccccccccccccccccccccccccc","trustLevel":"signed","signature":{"status":"declared","keyId":"flathub-summary-v1"}},"install":{"requiredBytes":419430400,"permissions":["network","audio","notifications"],"conflicts":[]}},
    {"id":"software.aur.visual-studio-code","sourceId":"source.aur.reviewed","sourceType":"reviewed-aur","packageRef":"visual-studio-code-bin","displayName":"Visual Studio Code","summary":"Declared binary AUR snapshot with pinned contract provenance.","version":"1.104","architecture":"x86_64","keywords":["editor","development"],"provenance":{"assurance":"contract-seed","publisher":"Microsoft","origin":"https://aur.archlinux.org/packages/visual-studio-code-bin","artifactDigest":"sha256:4444444444444444444444444444444444444444444444444444444444444444","reviewRevision":"sha256:dddddddddddddddddddddddddddddddddddddddddddddddddddddddddddddddd","trustLevel":"reviewed","signature":{"status":"declared","keyId":"omarchy-aur-review-v1"}},"install":{"requiredBytes":629145600,"permissions":["network","filesystem-home"],"conflicts":[]}},
    {"id":"software.appimage.obsidian","sourceId":"source.appimage.reviewed","sourceType":"appimage","packageRef":"obsidian.AppImage","displayName":"Obsidian","summary":"Pinned contract AppImage artifact planned through an isolated adapter.","version":"1.9","architecture":"x86_64","keywords":["notes","knowledge"],"provenance":{"assurance":"contract-seed","publisher":"Obsidian","origin":"https://obsidian.md/download","artifactDigest":"sha256:5555555555555555555555555555555555555555555555555555555555555555","reviewRevision":"sha256:eeeeeeeeeeeeeeeeeeeeeeeeeeeeeeeeeeeeeeeeeeeeeeeeeeeeeeeeeeeeeeee","trustLevel":"sandboxed","signature":{"status":"declared","keyId":"omarchy-appimage-review-v1"}},"install":{"requiredBytes":314572800,"permissions":["network","filesystem-home"],"conflicts":[]}},
    {"id":"software.webapp.figma","sourceId":"source.webapp.reviewed","sourceType":"web-app","packageRef":"https://www.figma.com/","displayName":"Figma","summary":"Declared browser-isolated Figma application launcher contract.","version":"web","architecture":"any","keywords":["design","web"],"provenance":{"assurance":"contract-seed","publisher":"Figma","origin":"https://www.figma.com/","artifactDigest":"sha256:6666666666666666666666666666666666666666666666666666666666666666","reviewRevision":"sha256:ffffffffffffffffffffffffffffffffffffffffffffffffffffffffffffffff","trustLevel":"sandboxed","signature":{"status":"declared","keyId":"omarchy-web-review-v1"}},"install":{"requiredBytes":1048576,"permissions":["network","notifications"],"conflicts":[]}}
  ]
}
